{
  "schema_version": "1.0",
  "run_id": "seobility-vs-ahrefs-demo",
  "draft_version": 1,
  "generated_at": "2026-08-27T08:18:00Z",
  "status": "pass",
  "checks": [
    {
      "check_id": "SEO-INTENT",
      "label": "Commercial comparison intent",
      "required": true,
      "status": "pass",
      "evidence": "The title and body directly compare both products.",
      "recommendation": null
    },
    {
      "check_id": "SEO-TITLE",
      "label": "Primary keyword in title",
      "required": true,
      "status": "pass",
      "evidence": "The title contains Seobility vs Ahrefs.",
      "recommendation": null
    }
  ],
  "findings": [],
  "required_changes": []
}
